<?xml version="1.0" encoding="UTF-8"?>

<ratingdoc xmlns:xsi="http://www.w3.org/2001/XMLSchema-instance" xsi:schemaLocation="http://www.waits.net/XML/xmlrate.xsd">

	<player>
		<name>no ties</name>
		<rating>1472.6</rating>
		<deviation>100.3</deviation>
		<variance>0.06</variance>
	</player>

	<player>
		<name>zzyzzx</name>
		<rating>1657.5</rating>
		<deviation>106.0</deviation>
		<variance>0.06</variance>
	</player>

	<player>
		<name>penguins</name>
		<rating>1436.3</rating>
		<deviation>103.2</deviation>
		<variance>0.06</variance>
	</player>

	<player>
		<name>spitfires</name>
		<rating>1801.5</rating>
		<deviation>112.3</deviation>
		<variance>0.06</variance>
	</player>

	<player>
		<name>space monkeys</name>
		<rating>1659.8</rating>
		<deviation>98.1</deviation>
		<variance>0.06</variance>
	</player>

	<player>
		<name>plug uglys</name>
		<rating>1125.4</rating>
		<deviation>113.1</deviation>
		<variance>0.06</variance>
	</player>

	<player>
		<name>shockers</name>
		<rating>1196.3</rating>
		<deviation>117.0</deviation>
		<variance>0.06</variance>
	</player>

	<player>
		<name>phantoms</name>
		<rating>1652.6</rating>
		<deviation>98.6</deviation>
		<variance>0.06</variance>
	</player>

	<player>
		<name>battle apples</name>
		<rating>1302.6</rating>
		<deviation>156.9</deviation>
		<variance>0.06</variance>
	</player>

	<player>
		<name>blackouts</name>
		<rating>1531.3</rating>
		<deviation>121.4</deviation>
		<variance>0.06</variance>
	</player>

	<player>
		<name>coaches team</name>
	</player>

	<player>
		<name>old school</name>
	</player>

	<player>
		<name>ballistic</name>
	</player>

	<player>
		<name>velocity</name>
	</player>

	<player>
		<name>puckheads</name>
	</player>

	<player>
		<name>demons</name>
	</player>

	<player>
		<name>section 8</name>
	</player>

	<player>
		<name>who's your daddy</name>
	</player>

	<player>
		<name>blackhawks</name>
	</player>

	<player>
		<name>tiger sharks</name>
	</player>

	<period>
		<game>
			<home>phantoms</home>
			<away>spitfires</away>
			<result>loss</result>
		</game>
		<game>
			<home>battle apples</home>
			<away>blackouts</away>
			<result>loss</result>
		</game>
		<game>
			<home>zzyzzx</home>
			<away>penguins</away>
			<result>loss</result>
		</game>
		<game>
			<home>plug uglys</home>
			<away>space monkeys</away>
			<result>loss</result>
		</game>
		<game>
			<home>no ties</home>
			<away>coaches team</away>
			<result>win</result>
		</game>
	</period>

	<period>
		<game>
			<home>spitfires</home>
			<away>no ties</away>
			<result>draw</result>
		</game>
		<game>
			<home>penguins</home>
			<away>blackouts</away>
			<result>win</result>
		</game>
		<game>
			<home>zzyzzx</home>
			<away>plug uglys</away>
			<result>win</result>
		</game>
		<game>
			<home>space monkeys</home>
			<away>old school</away>
			<result>win</result>
		</game>
		<game>
			<home>coaches team</home>
			<away>shockers</away>
			<result>win</result>
		</game>
		<game>
			<home>phantoms</home>
			<away>battle apples</away>
			<result>win</result>
		</game>
	</period>

	<period>
		<game>
			<home>space monkeys</home>
			<away>zzyzzx</away>
			<result>win</result>
		</game>
		<game>
			<home>coaches team</home>
			<away>battle apples</away>
			<result>win</result>
		</game>
		<game>
			<home>plug uglys</home>
			<away>phantoms</away>
			<result>loss</result>
		</game>
		<game>
			<home>shockers</home>
			<away>spitfires</away>
			<result>loss</result>
		</game>
		<game>
			<home>blackouts</home>
			<away>old school</away>
			<result>win</result>
		</game>
		<game>
			<home>no ties</home>
			<away>penguins</away>
			<result>loss</result>
		</game>
	</period>

	<period>
		<game>
			<home>old school</home>
			<away>phantoms</away>
			<result>loss</result>
		</game>
		<game>
			<home>plug uglys</home>
			<away>no ties</away>
			<result>loss</result>
		</game>
		<game>
			<home>shockers</home>
			<away>zzyzzx</away>
			<result>loss</result>
		</game>
		<game>
			<home>blackouts</home>
			<away>space monkeys</away>
			<result>win</result>
		</game>
		<game>
			<home>coaches team</home>
			<away>penguins</away>
			<result>loss</result>
		</game>
		<game>
			<home>spitfires</home>
			<away>battle apples</away>
			<result>win</result>
		</game>
	</period>

	<period>
		<game>
			<home>battle apples</home>
			<away>shockers</away>
			<result>loss</result>
		</game>
		<game>
			<home>zzyzzx</home>
			<away>blackouts</away>
			<result>win</result>
		</game>
		<game>
			<home>space monkeys</home>
			<away>phantoms</away>
			<result>loss</result>
		</game>
		<game>
			<home>no ties</home>
			<away>old school</away>
			<result>win</result>
		</game>
		<game>
			<home>penguins</home>
			<away>spitfires</away>
			<result>loss</result>
		</game>
		<game>
			<home>coaches team</home>
			<away>plug uglys</away>
			<result>win</result>
		</game>
	</period>

	<period>
		<game>
			<home>no ties</home>
			<away>space monkeys</away>
			<result>win</result>
		</game>
		<game>
			<home>old school</home>
			<away>coaches team</away>
			<result>win</result>
		</game>
		<game>
			<home>penguins</home>
			<away>battle apples</away>
			<result>win</result>
		</game>
		<game>
			<home>plug uglys</home>
			<away>spitfires</away>
			<result>draw</result>
		</game>
		<game>
			<home>phantoms</home>
			<away>zzyzzx</away>
			<result>loss</result>
		</game>
		<game>
			<home>shockers</home>
			<away>blackouts</away>
			<result>win</result>
		</game>
	</period>

	<period>
		<game>
			<home>blackouts</home>
			<away>phantoms</away>
			<result>loss</result>
		</game>
		<game>
			<home>penguins</home>
			<away>shockers</away>
			<result>win</result>
		</game>
		<game>
			<home>zzyzzx</home>
			<away>no ties</away>
			<result>win</result>
		</game>
		<game>
			<home>space monkeys</home>
			<away>coaches team</away>
			<result>loss</result>
		</game>
		<game>
			<home>battle apples</home>
			<away>plug uglys</away>
			<result>loss</result>
		</game>
		<game>
			<home>spitfires</home>
			<away>old school</away>
			<result>win</result>
		</game>
	</period>

	<period>
		<game>
			<home>phantoms</home>
			<away>shockers</away>
			<result>win</result>
		</game>
		<game>
			<home>blackouts</home>
			<away>no ties</away>
			<result>loss</result>
		</game>
		<game>
			<home>battle apples</home>
			<away>old school</away>
			<result>win</result>
		</game>
		<game>
			<home>plug uglys</home>
			<away>penguins</away>
			<result>loss</result>
		</game>
		<game>
			<home>space monkeys</home>
			<away>spitfires</away>
			<result>draw</result>
		</game>
		<game>
			<home>zzyzzx</home>
			<away>coaches team</away>
			<result>win</result>
		</game>
	</period>

	<period>
		<game>
			<home>spitfires</home>
			<away>zzyzzx</away>
			<result>loss</result>
		</game>
		<game>
			<home>space monkeys</home>
			<away>battle apples</away>
			<result>win</result>
		</game>
		<game>
			<home>no ties</home>
			<away>phantoms</away>
			<result>loss</result>
		</game>
		<game>
			<home>coaches team</home>
			<away>blackouts</away>
			<result>loss</result>
		</game>
		<game>
			<home>shockers</home>
			<away>plug uglys</away>
			<result>loss</result>
		</game>
		<game>
			<home>old school</home>
			<away>penguins</away>
			<result>loss</result>
		</game>
	</period>

	<period>
		<game>
			<home>old school</home>
			<away>shockers</away>
			<result>win</result>
		</game>
	</period>

	<!-- mon, 4/25 -->
	<period>
		<game>
			<home>spitfires</home>
			<away>coaches team</away>
			<result>win</result>
		</game>
		<game>
			<home>battle apples</home>
			<away>no ties</away>
			<result>loss</result>
		</game>
		<game>
			<home>old school</home>
			<away>zzyzzx</away>
			<result>loss</result>
		</game>
		<game>
			<home>penguins</home>
			<away>phantoms</away>
			<result>loss</result>
		</game>
		<game>
			<home>blackouts</home>
			<away>plug uglys</away>
			<result>win</result>
		</game>
		<game>
			<home>shockers</home>
			<away>space monkeys</away>
			<result>loss</result>
		</game>
	</period>

	<!-- wed, 4/27 -->
	<period>
		<game>
			<home>shockers</home>
			<away>ballistic</away>
			<result>loss</result>
		</game>
		<game>
			<home>blackhawks</home>
			<away>puckheads</away>
			<result>win</result>
		</game>
		<game>
			<home>section 8</home>
			<away>velocity</away>
			<result>draw</result>
		</game>
		<game>
			<home>demons</home>
			<away>spitfires</away>
			<result>draw</result>
		</game>
		<game>
			<home>who's your daddy</home>
			<away>tiger sharks</away>
			<result>draw</result>
		</game>
	</period>

    <!-- mon, 5/2 (playoffs round 1) -->
    <period>
        <game>
            <home>no ties</home>
            <away>penguins</away>
            <result>loss</result>
        </game>
        <game>
            <home>phantoms</home>
            <away>space monkeys</away>
            <result>loss</result>
        </game>
        <game>
            <home>zzyzzx</home>
            <away>coaches team</away>
            <result>loss</result>
        </game>
        <game>
            <home>spitfires</home>
            <away>blackouts</away>
            <result>win</result>
        </game>
    </period>

    <!-- wed 5/11 -->
    <period>
        <game>
            <home>velocity</home>
            <away>shockers</away>
            <result>win</result>
        </game>
        <game>
            <home>who's your daddy</home>
            <away>demons</away>
            <result>win</result>
        </game>
        <game>
            <home>ballistic</home>
            <away>puckheads</away>
            <result>win</result>
        </game>
        <game>
            <home>section 8</home>
            <away>blackhawks</away>
            <result>loss</result>
        </game>
        <game>
            <home>spitfires</home>
            <away>tiger sharks</away>
            <result>win</result>
        </game>
    </period>

</ratingdoc>

