<?xml version="1.0" encoding="UTF-8"?>

<ratingdoc xmlns:xsi="http://www.w3.org/2001/XMLSchema-instance" xsi:schemaLocation="http://www.waits.net/XML/xmlrate.xsd">

    <player>
        <name>penguins</name>
    </player>

    <player>
        <name>no ties</name>
    </player>

    <player>
        <name>zzyzzx</name>
    </player>

    <player>
        <name>spitfires</name>
    </player>

    <player>
        <name>red liners</name>
    </player>

    <player>
        <name>space monkeys</name>
    </player>

    <player>
        <name>phantoms</name>
    </player>

    <player>
        <name>jinx</name>
    </player>

    <player>
        <name>plug uglys</name>
    </player>

    <player>
        <name>shockers</name>
    </player>


    <period>
        <game>
            <home>jinx</home>
            <away>space monkeys</away>
            <result>win</result>
        </game>

        <game>
            <home>zzyzzx</home>
            <away>no ties</away>
            <result>loss</result>
        </game>

        <game>
            <home>plug uglys</home>
            <away>red liners</away>
            <result>loss</result>
        </game>

        <game>
            <home>phantoms</home>
            <away>penguins</away>
            <result>loss</result>
        </game>
    </period>

    <period>
        <game>
            <home>no ties</home>
            <away>spitfires</away>
            <result>loss</result>
        </game>

        <game>
            <home>jinx</home>
            <away>phantoms</away>
            <result>loss</result>
        </game>

        <game>
            <home>space monkeys</home>
            <away>shockers</away>
            <result>win</result>
        </game>

        <game>
            <home>zzyzzx</home>
            <away>plug uglys</away>
            <result>win</result>
        </game>

        <game>
            <home>penguins</home>
            <away>red liners</away>
            <result>win</result>
        </game>
    </period>

    <period>
        <game>
            <home>penguins</home>
            <away>zzyzzx</away>
            <result>loss</result>
        </game>

        <game>
            <home>spitfires</home>
            <away>plug uglys</away>
            <result>win</result>
        </game>

        <game>
            <home>no ties</home>
            <away>shockers</away>
            <result>win</result>
        </game>

        <game>
            <home>red liners</home>
            <away>jinx</away>
            <result>win</result>
        </game>

        <game>
            <home>space monkeys</home>
            <away>phantoms</away>
            <result>draw</result>
        </game>
    </period>

		<period>

			<game>
				<home>jinx</home>
				<away>zzyzzx</away>
				<result>loss</result>
			</game>

			<game>
				<home>red liners</home>
				<away>space monkeys</away>
				<result>loss</result>
			</game>

			<game>
				<home>plug uglys</home>
				<away>no ties</away>
				<result>loss</result>
			</game>

			<game>
				<home>spitfires</home>
				<away>penguins</away>
				<result>win</result>
			</game>

			<game>
				<home>phantoms</home>
				<away>shockers</away>
				<result>win</result>
			</game>

		</period>

		<period>

			<game>
				<home>shockers</home>
				<away>plug uglys</away>
				<result>draw</result>
			</game>

			<game>
				<home>spitfires</home>
				<away>jinx</away>
				<result>win</result>
			</game>

			<game>
				<home>penguins</home>
				<away>no ties</away>
				<result>loss</result>
			</game>

			<game>
				<home>red liners</home>
				<away>phantoms</away>
				<result>win</result>
			</game>

			<game>
				<home>space monkeys</home>
				<away>zzyzzx</away>
				<result>loss</result>
			</game>

		</period>

		<period> <!-- July 26th -->

			<game>
				<home>plug uglys</home>
				<away>penguins</away>
				<result>draw</result>
			</game>

			<game>
				<home>spitfires</home>
				<away>space monkeys</away>
				<result>draw</result>
			</game>

			<game>
				<home>shockers</home>
				<away>red liners</away>
				<result>loss</result>
			</game>

			<game>
				<home>phantoms</home>
				<away>zzyzzx</away>
				<result>loss</result>
			</game>

			<game>
				<home>no ties</home>
				<away>jinx</away>
				<result>loss</result>
			</game>

		</period>

		<period> <!-- August 2nd -->

			<game>
				<home>phantoms</home>
				<away>spitfires</away>
				<result>loss</result>
			</game>

			<game>
				<home>plug uglys</home>
				<away>jinx</away>
				<result>win</result>
			</game>

			<game>
				<home>no ties</home>
				<away>space monkeys</away>
				<result>loss</result>
			</game>

			<game>
				<home>shockers</home>
				<away>penguins</away>
				<result>loss</result>
			</game>

			<game>
				<home>zzyzzx</home>
				<away>red liners</away>
				<result>loss</result>
			</game>

		</period>

		<period> <!-- August 9th -->

			<game>
				<home>space monkeys</home>
				<away>plug uglys</away>
				<result>win</result>
			</game>

			<game>
				<home>penguins</home>
				<away>jinx</away>
				<result>win</result>
			</game>

			<game>
				<home>red liners</home>
				<away>spitfires</away>
				<result>loss</result>
			</game>

			<game>
				<home>zzyzzx</home>
				<away>shockers</away>
				<result>win</result>
			</game>

			<game>
				<home>phantoms</home>
				<away>no ties</away>
				<result>draw</result>
			</game>

		</period>

		<period> <!-- August 16th -->

			<game>
				<home>red liners</home>
				<away>no ties</away>
				<result>win</result>
			</game>

			<game>
				<home>zzyzzx</home>
				<away>spitfires</away>
				<result>win</result> <!-- upset! -->
			</game>

			<game>
				<home>space monkeys</home>
				<away>penguins</away>
				<result>win</result>
			</game>

			<game>
				<home>plug uglys</home>
				<away>phantoms</away>
				<result>loss</result>
			</game>

			<game>
				<home>jinx</home>
				<away>shockers</away>
				<result>draw</result>
			</game>

		</period>

		<period> <!-- August 23rd -->

			<game>
				<home>spitfires</home>
				<away>shockers</away>
				<result>win</result>
			</game>

			<game>
				<home>no ties</home>
				<away>zzyzzx</away>
				<result>draw</result>
			</game>

			<game>
				<home>space monkeys</home>
				<away>jinx</away>
				<result>win</result>
			</game>

			<game>
				<home>red liners</home>
				<away>plug uglys</away>
				<result>win</result>
			</game>

		</period>

		<period> <!-- August 30th -->

			<game>
				<home>spitfires</home>
				<away>shockers</away>
				<result>win</result>
			</game>

		</period>

		<period> <!-- Sep 13th -->

			<game>
				<home>red liners</home>
				<away>phantoms</away>
				<result>win</result>
			</game>

			<game>
				<home>red liners</home>
				<away>space monkeys</away>
				<result>win</result>
			</game>

			<game>
				<home>spitfires</home>
				<away>phantoms</away>
				<result>loss</result>
			</game>

			<!-- other games unknown!!! -->

		</period>

</ratingdoc>

